{
  "benchmark_version": "0.1.0",
  "schema_version": "0.1",
  "submission_id": "SUB-FAS-001",
  "case_id": "FAS-001",
  "system": {
    "system_name": "phase2-fixture-agent",
    "system_version": "1.0",
    "timestamp": "2026-09-19T18:00:00Z"
  },
  "verdict": {
    "benchmark_version": "0.1.0",
    "schema_version": "0.1",
    "verdict": "NOT_EXPLOITABLE",
    "reason_code": "BLOCKED_BY_NETWORK_POLICY",
    "confidence": 0.9,
    "rationale": "Fixture rationale for Dead SSRF.",
    "claim_ids": [
      "CLM-001-001"
    ],
    "evidence_ids": [
      "EVD-001-001"
    ],
    "attack_path_ids": [
      "P-001-001"
    ]
  },
  "findings": [
    {
      "finding_id": "FIND-001-001",
      "title": "Dead SSRF",
      "category": "C1_REACHABILITY",
      "severity": "HIGH",
      "description": "Structured contract fixture for Dead SSRF.",
      "claim_ids": [
        "CLM-001-001"
      ],
      "evidence_ids": [
        "EVD-001-001"
      ],
      "verdict": "NOT_EXPLOITABLE",
      "confidence": 0.9
    }
  ],
  "claims": [
    {
      "claim_id": "CLM-001-001",
      "benchmark_version": "0.1.0",
      "schema_version": "0.1",
      "claim_type": "REACHABILITY",
      "statement": "Dead SSRF condition is represented by the fixture.",
      "subject": "attacker_input",
      "predicate": "reaches",
      "object": "security_boundary",
      "confidence": 0.9,
      "status": "ASSERTED",
      "related_evidence": [
        "EVD-001-001"
      ],
      "provenance": "DECLARED"
    }
  ],
  "evidence": [
    {
      "evidence_id": "EVD-001-001",
      "benchmark_version": "0.1.0",
      "schema_version": "0.1",
      "type": "SOURCE_LOCATION",
      "role": "DIRECT",
      "verification": "VERIFIED",
      "description": "Contract fixture evidence.",
      "location": {
        "repository": "fixture-repo",
        "commit": "abc123",
        "file": "app.py",
        "line_start": 10,
        "line_end": 12,
        "language": "python"
      },
      "related_claims": [
        "CLM-001-001"
      ],
      "provenance": "OBSERVED"
    }
  ],
  "attack_paths": [
    {
      "path_id": "P-001-001",
      "node_ids": [
        "N-FAS-001-input",
        "N-FAS-001-control",
        "N-FAS-001-impact"
      ],
      "edge_ids": [
        "E-FAS-001-1",
        "E-FAS-001-2"
      ],
      "entry_node": "N-FAS-001-input",
      "impact_node": "N-FAS-001-impact",
      "status": "BLOCKED",
      "evidence_ids": [
        "EVD-001-001"
      ]
    }
  ],
  "impact": {
    "confidentiality": "MEDIUM",
    "integrity": "MEDIUM",
    "availability": "LOW"
  },
  "remediation": null,
  "verification": {
    "verification_id": "VER-FAS-001",
    "status": "VERIFIED",
    "method": "Contract fixture verification",
    "evidence_ids": [
      "EVD-001-001"
    ],
    "timestamp": "2026-09-19T18:00:00Z"
  },
  "metadata": {
    "fixture": true,
    "difficulty": "L2_MULTI_FUNCTION"
  }
}