{
  "benchmark_version": "0.1.0",
  "schema_version": "0.1",
  "submission_id": "SUB-FAS-001-GOLD",
  "case_id": "FAS-001",
  "system": {
    "system_name": "phase5-gold-fixture",
    "system_version": "1.0"
  },
  "verdict": {
    "benchmark_version": "0.1.0",
    "schema_version": "0.1",
    "verdict": "NOT_EXPLOITABLE",
    "reason_code": "BLOCKED_BY_NETWORK_POLICY",
    "confidence": 1,
    "rationale": "Effective security control blocks the candidate path.",
    "claim_ids": [
      "CLM-001-001"
    ],
    "evidence_ids": [
      "EVD-001-001"
    ],
    "attack_path_ids": [
      "P-001-001"
    ]
  },
  "findings": [
    {
      "finding_id": "FIND-001-001",
      "title": "Dead SSRF",
      "category": "C1_REACHABILITY",
      "severity": "MEDIUM",
      "description": "An attacker-controlled URL reaches the outbound HTTP client, but the effective destination allowlist blocks unauthorized destinations.",
      "claim_ids": [
        "CLM-001-001"
      ],
      "evidence_ids": [
        "EVD-001-001"
      ],
      "verdict": "NOT_EXPLOITABLE",
      "confidence": 1
    }
  ],
  "claims": [
    {
      "claim_id": "CLM-001-001",
      "benchmark_version": "0.1.0",
      "schema_version": "0.1",
      "claim_type": "REACHABILITY",
      "statement": "An attacker-controlled URL reaches the outbound HTTP client, but the effective destination allowlist blocks unauthorized destinations.",
      "subject": "attacker",
      "predicate": "security_condition",
      "object": "Effective security control blocks the candidate path.",
      "confidence": 1,
      "status": "SUPPORTED",
      "related_evidence": [
        "EVD-001-001"
      ],
      "provenance": "VERIFIED"
    }
  ],
  "evidence": [
    {
      "evidence_id": "EVD-001-001",
      "benchmark_version": "0.1.0",
      "schema_version": "0.1",
      "type": "TEST_RESULT",
      "role": "DIRECT",
      "verification": "VERIFIED",
      "description": "Deterministic oracle evidence for FAS-001.",
      "location": {
        "repository": "cases/FAS-001",
        "commit": "phase3-initial",
        "file": "repository/state.json",
        "line_start": 1,
        "line_end": 1,
        "language": "json"
      },
      "related_claims": [
        "CLM-001-001"
      ],
      "provenance": "VERIFIED",
      "fact": {
        "artifact_path": "repository/state.json",
        "key": "path_viable",
        "operator": "EQUALS",
        "value": false
      }
    }
  ],
  "attack_paths": [
    {
      "path_id": "P-001-001",
      "node_ids": [
        "N-001-input",
        "N-001-control",
        "N-001-impact"
      ],
      "edge_ids": [
        "E-001-1",
        "E-001-2"
      ],
      "entry_node": "N-001-input",
      "impact_node": "N-001-impact",
      "status": "BLOCKED",
      "evidence_ids": [
        "EVD-001-001"
      ]
    }
  ],
  "impact": {},
  "remediation": {
    "remediation_id": "REM-001-001",
    "target_claim_ids": [
      "CLM-001-001"
    ],
    "original_verdict": "NOT_EXPLOITABLE",
    "proposed_change": "No remediation is asserted for this case.",
    "original_path_ids": [
      "P-001-001"
    ],
    "revalidated_path_ids": [],
    "alternate_path_ids": [],
    "verification_status": "NOT_ASSESSED",
    "evidence_ids": [
      "EVD-001-001"
    ],
    "final_verdict": "NOT_EXPLOITABLE",
    "benchmark_version": "0.1.0",
    "schema_version": "0.1"
  },
  "verification": null
}
